Title,Portfolio,Entity,URL
Department of Social Services 2023-24 Annual Report,Social Services,Department of Social Services,https:/www.transparency.gov.au/publications/social-services/department-of-social-services/department-of-social-services-2023-24-annual-report
DVA Annual Report 2023-24,Veterans' Affairs,Department of Veterans' Affairs,https:/www.transparency.gov.au/publications/veterans-affairs/department-of-veterans-affairs/dva-annual-report-2023-24
Department of the House of Representatives Annual Report 2023-24,Parliamentary Departments (not a portfolio),Department of the House of Representatives,https:/www.transparency.gov.au/publications/parliamentary-departments-not-a-portfolio/department-of-the-house-of-representatives/department-of-the-house-of-representatives-annual-report-2023-24
Annual Report 2023-24,Prime Minister and Cabinet,Department of the Prime Minister and Cabinet,https:/www.transparency.gov.au/publications/prime-minister-and-cabinet/department-of-the-prime-minister-and-cabinet/annual-report-2023-24
Department of the Senate Annual Report 2023-24,Parliamentary Departments (not a portfolio),Department of the Senate,https:/www.transparency.gov.au/publications/parliamentary-departments-not-a-portfolio/department-of-the-senate/department-of-the-senate-annual-report-2023-24
Treasury Annual Report 2023-24,Treasury,Department of the Treasury,https:/www.transparency.gov.au/publications/treasury/department-treasury/treasury-annual-report-2023-24
Digital Transformation Agency Annual Report 2023-24,Finance,Digital Transformation Agency,https:/www.transparency.gov.au/publications/finance/digital-transformation-agency/digital-transformation-agency-annual-report-2023-24
Director of National Parks Annual Report 2023-24,"Agriculture, Water and the Environment",Director of National Parks,https:/www.transparency.gov.au/publications/agriculture-water-and-the-environment/director-of-national-parks/director-of-national-parks-annual-report-2023-24
"Domestic, Family and Sexual Violence Commission Annual Report 2023-24",Social Services,"Domestic, Family and Sexual Violence Commission",https:/www.transparency.gov.au/publications/social-services/domestic-family-and-sexual-violence-commission/domestic-family-and-sexual-violence-commission-annual-report-2023-24
Export Finance Australia Annual Report 2023-2024 ,Foreign Affairs and Trade,"Export Finance and Insurance Corporation (EFIC, Export Finance Australia)",https:/www.transparency.gov.au/publications/foreign-affairs-and-trade/export-finance-and-insurance-corporation-efic-export-finance-australia/export-finance-australia-annual-report-2023-2024
Fair Work Commission - Annual Report 2023-24 - Access to Justice ,Attorney-General's,Fair Work Commission,https:/www.transparency.gov.au/publications/attorney-general-s/fair-work-commission/fair-work-commission-annual-report-2023-24-access-to-justice
Federal Court of Australia Listed Entity Annual Report 2023-24,Attorney-General's,Federal Court of Australia,https:/www.transparency.gov.au/publications/attorney-general-s/federal-court-of-australia/fca-listed-entity-ar-2023-24
Fisheries Research and Development Corporation 2023-24,Agriculture,Fisheries Research and Development Corporation,https:/www.transparency.gov.au/publications/agriculture/fisheries-research-and-development-corporation/fisheries-research-and-development-corporation-2023-24
Food Standards Australia New Zealand Annual Report 2023-24,Health,Food Standards Australia New Zealand,https:/www.transparency.gov.au/publications/health/food-standards-australia-new-zealand/food-standards-australia-new-zealand-annual-report-2023-24
Future Fund Management Agency Annual Report 2023-24,Finance,Future Fund Management Agency,https:/www.transparency.gov.au/publications/finance/future-fund-management-agency/future-fund-management-agency-annual-report-2023-24
Geoscience Australia Annual Report 2023-24,"Industry, Innovation and Science",Geoscience Australia,https:/www.transparency.gov.au/publications/industry-innovation-and-science/geoscience-australia/geoscience-australia-annual-report-2023-24
Grains Research and Development Corporation Annual Report 2023-24,Agriculture,Grains Research and Development Corporation,https:/www.transparency.gov.au/publications/agriculture/grains-research-and-development-corporation/grains-research-and-development-corporation-annual-report-2023-24
Great Barrier Reef Marine Park Authority Annual Report 2023-24,"Agriculture, Water and the Environment",Great Barrier Reef Marine Park Authority,https:/www.transparency.gov.au/publications/agriculture-water-and-the-environment/great-barrier-reef-marine-park-authority/great-barrier-reef-marine-park-authority-annual-report-2023-24
High Speed Rail Authority Annual Report 2023-24,"Infrastructure, Transport, Regional Development, Communications and the Arts",High Speed Rail Authority,https:/www.transparency.gov.au/publications/infrastructure-transport-regional-development-communications-and-the-arts/high-speed-rail-authority/high-speed-rail-authority-annual-report-2023-24
Housing Australia Annual Report 2023-24,Treasury,Housing Australia,https:/www.transparency.gov.au/publications/treasury/housing-australia/housing-australia-annual-report-2023-24
IP Australia Annual Report 2023-24,"Industry, Innovation and Science",IP Australia,https:/www.transparency.gov.au/publications/industry-innovation-and-science/ip-australia/ip-australia-annual-report-2023-24
Independent Health and Aged Care Pricing Authority Annual Report 2023-24,Health and Aged Care,Independent Health and Aged Care Pricing Authority,https:/www.transparency.gov.au/publications/health-and-aged-care/independent-health-and-aged-care-pricing-authority/independent-health-and-aged-care-pricing-authority-annual-report-2023-24
Independent Parliamentary Expenses Authority – Annual Report 2023–24,Finance,Independent Parliamentary Expenses Authority,https:/www.transparency.gov.au/publications/finance/independent-parliamentary-expenses-authority/independent-parliamentary-expenses-authority-annual-report-2023-24
Indigenous Business Australia Annual Report 2023-24,Prime Minister and Cabinet,Indigenous Business Australia,https:/www.transparency.gov.au/publications/prime-minister-and-cabinet/indigenous-business-australia/indigenous-business-australia-annual-report-2023-24
Indigenous Land and Sea Corporation Annual Report 2023-24,Prime Minister and Cabinet,Indigenous Land and Sea Corporation,https:/www.transparency.gov.au/publications/prime-minister-and-cabinet/indigenous-land-and-sea-corporation/indigenous-land-and-sea-corporation-annual-report-2023-24
"2023-24 
Annual Report","Infrastructure, Transport, Cities and Regional Development",Infrastructure Australia,https:/www.transparency.gov.au/publications/infrastructure-transport-cities-and-regional-development/infrastructure-australia/2023-24-annual-report
Inspector-General of Taxation Annual Report 2023-24,Treasury,Inspector-General of Taxation,https:/www.transparency.gov.au/publications/treasury/inspector-general-of-taxation/inspector-general-of-taxation-annual-report-2023-24
Murray-Darling Basin Authority Annual Report 2023-24,Agriculture,Murray-Darling Basin Authority,https:/www.transparency.gov.au/publications/agriculture/murray-darling-basin-authority/murray-darling-basin-authority-annual-report-2023-24
NBN 2024 Annual Report,Communications and the Arts,NBN Co Limited,https:/www.transparency.gov.au/publications/communications-and-the-arts/nbn-co-limited/nbn-2024-annual-report
NDIS Quality and Safeguards Commission Annual Report 2023-24,Social Services,NDIS Quality and Safeguards Commission,https:/www.transparency.gov.au/publications/social-services/ndis-quality-and-safeguards-commission/ndis-quality-and-safeguards-commission-annual-report-2023-24
National Anti-Corruption Commission Annual Report 2023-24,Attorney-General's,National Anti-Corruption Commission,https:/www.transparency.gov.au/publications/attorney-general-s/national-anti-corruption-commission/national-anti-corruption-commission-annual-report-2023-24
National Archives of Australia Annual Report 2023-24,"Infrastructure, Transport, Regional Development, Communications and the Arts",National Archives of Australia,https:/www.transparency.gov.au/publications/infrastructure-transport-regional-development-communications-and-the-arts/national-archives-of-australia/national-archives-of-australia-annual-report-2023-24
National Australia Day Council Limited Annual Report 2023-24,Prime Minister and Cabinet,National Australia Day Council Limited,https:/www.transparency.gov.au/publications/prime-minister-and-cabinet/national-australia-day-council-limited/national-australia-day-council-limited-annual-report-2023-24
National Blood Authority Annual Report 2023-24,Health,National Blood Authority,https:/www.transparency.gov.au/publications/health/national-blood-authority/national-blood-authority-annual-report-2023-24
National Capital Authority Annual Report 2023-24,"Infrastructure, Transport, Cities and Regional Development",National Capital Authority,https:/www.transparency.gov.au/publications/infrastructure-transport-cities-and-regional-development/national-capital-authority/national-capital-authority-annual-report-2023-24
National Competition Council Annual Report 2023-24,Treasury,National Competition Council,https:/www.transparency.gov.au/publications/treasury/national-competition-council/national-competition-council-annual-report-2023-24
"National Disability Insurance Agency Annual Report 2023-24
",Social Services,National Disability Insurance Agency,https:/www.transparency.gov.au/publications/social-services/national-disability-insurance-agency/national-disability-insurance-agency-annual-report-2023-24
National Emergency Management Agency Annual Report 2023-24,Home Affairs,National Emergency Management Agency,https:/www.transparency.gov.au/publications/home-affairs/national-emergency-management-agency/national-emergency-management-agency-annual-report-2023-24
National Film and Sound Archive Annual Report 2023-24,Communications and the Arts,National Film and Sound Archive of Australia,https:/www.transparency.gov.au/publications/communications-and-the-arts/national-film-and-sound-archive-of-australia/national-film-and-sound-archive-annual-report-2023-24
National Gallery of Australia Annual Report 2023-24,Communications and the Arts,National Gallery of Australia,https:/www.transparency.gov.au/publications/communications-and-the-arts/national-gallery-of-australia/national-gallery-of-australia-annual-report-2023-24
National Health Funding Body Annual Report 2023-24,Health,National Health Funding Body (NHFB),https:/www.transparency.gov.au/publications/health/national-health-funding-body-nhfb/national-health-funding-body-annual-report-2023-24
Annual Report 2023–24,Health,National Health and Medical Research Council (NHMRC),https:/www.transparency.gov.au/publications/health/national-health-and-medical-research-council-nhmrc/annual-report-2023-24
National Indigenous Australians Agency Annual Report 2023-24,Prime Minister and Cabinet,National Indigenous Australians Agency,https:/www.transparency.gov.au/publications/prime-minister-and-cabinet/national-indigenous-australians-agency/national-indigenous-australians-agency-annual-report-2023-24
National Intermodal Annual Report 2024 ,"Infrastructure, Transport, Regional Development, Communications and the Arts",National Intermodal Corporation Limited,https:/www.transparency.gov.au/publications/infrastructure-transport-regional-development-communications-and-the-arts/national-intermodal-corporation-limited/national-intermodal-annual-report-2024
National Library of Australia Annual Report 2023-24,Communications and the Arts,National Library of Australia,https:/www.transparency.gov.au/publications/communications-and-the-arts/national-library-of-australia/national-library-of-australia-annual-report-2023-24
National Mental Health Commission Annual Report 2023-24,Health,National Mental Health Commission,https:/www.transparency.gov.au/publications/health/national-mental-health-commission/national-mental-health-commission-annual-report-2023-24
National Museum of Australia Annual Report 2023-24,Communications and the Arts,National Museum of Australia,https:/www.transparency.gov.au/publications/communications-and-the-arts/national-museum-of-australia/national-museum-of-australia-annual-report-2023-24
National Offshore Petroleum Safety and Environmental Management Authority Annual Report 2023-24,"Industry, Innovation and Science",National Offshore Petroleum Safety and Environmental Management Authority (NOPSEMA),https:/www.transparency.gov.au/publications/industry-innovation-and-science/national-offshore-petroleum-safety-and-environmental-management-authority-nopsema/national-offshore-petroleum-safety-and-environmental-management-authority-annual-report-2023-24
Annual Report 2023-2024,Communications and the Arts,National Portrait Gallery of Australia,https:/www.transparency.gov.au/publications/communications-and-the-arts/national-portrait-gallery-of-australia/annual-report-2023-2024
National Reconstruction Fund Corporation Annual Report 2023-24,"Industry, Science and Resources",National Reconstruction Fund Corporation,https:/www.transparency.gov.au/publications/industry-science-and-resources/national-reconstruction-fund-corporation/national-reconstruction-fund-corporation-annual-report-2023-24
National Transport Commission Annual Report 2023-24,"Infrastructure, Transport, Cities and Regional Development",National Transport Commission,https:/www.transparency.gov.au/publications/infrastructure-transport-cities-and-regional-development/national-transport-commission/national-transport-commission-annual-report-2023-24
Northern Australia Infrastructure Facility Annual Report 2023-2024,"Industry, Innovation and Science",Northern Australia Infrastructure Facility,https:/www.transparency.gov.au/publications/industry-innovation-and-science/northern-australia-infrastructure-facility/northern-australia-infrastructure-facility-annual-report-2023-2024
Northern Land Council Annual Report 2023-24,Prime Minister and Cabinet,Northern Land Council,https:/www.transparency.gov.au/publications/prime-minister-and-cabinet/northern-land-council/northern-land-council-annual-report-2023-24
Northern Territory Aboriginal Investment Corporation Annual Report 2023-2024,Prime Minister and Cabinet,Northern Territory Aboriginal Investment Corporation,https:/www.transparency.gov.au/publications/prime-minister-and-cabinet/northern-territory-aboriginal-investment-corporation/northern-territory-aboriginal-investment-corporation-annual-report-2023-2024
Office of Parliamentary Counsel Annual Report 2023-24,Attorney-General's,Office of Parliamentary Counsel,https:/www.transparency.gov.au/publications/attorney-general-s/office-of-parliamentary-counsel/office-of-parliamentary-counsel-annual-report-2023-24
Office of the Auditing and Assurance Standards Board Annual Report 2023-24,Treasury,Office of the Auditing and Assurance Standards Board (AUASB),https:/www.transparency.gov.au/publications/treasury/office-of-the-auditing-and-assurance-standards-board-auasb/office-of-the-auditing-and-assurance-standards-board-annual-report-2023-24
Office of the Australian Accounting Standards Board Annual Report 2023-24,Treasury,Office of the Australian Accounting Standards Board (AASB),https:/www.transparency.gov.au/publications/treasury/office-of-the-australian-accounting-standards-board-aasb/office-of-the-australian-accounting-standards-board-annual-report-2023-24
Office of the Australian Information Commissioner Annual Report 2023-24,Attorney-General's,Office of the Australian Information Commissioner,https:/www.transparency.gov.au/publications/attorney-general-s/office-of-the-australian-information-commissioner/office-of-the-australian-information-commissioner-annual-report-2023-24
Office of the Commonwealth Ombudsman Annual Report 2023-24,Attorney-General's,Office of the Commonwealth Ombudsman,https:/www.transparency.gov.au/publications/attorney-general-s/office-of-the-commonwealth-ombudsman/office-of-the-commonwealth-ombudsman-annual-report-2023-24
Office of the Director of Public Prosecutions (Cth) Annual Report 2023-24,Attorney-General's,Office of the Director of Public Prosecutions (CDPP),https:/www.transparency.gov.au/publications/attorney-general-s/office-of-the-director-of-public-prosecutions-cdpp/office-of-the-director-of-public-prosecutions-cth-annual-report-2023-24
Office of the Fair Work Ombudsman 2023-24 Annual Report,Attorney-General's,Office of the Fair Work Ombudsman,https:/www.transparency.gov.au/publications/attorney-general-s/office-of-the-fair-work-ombudsman/office-of-the-fair-work-ombudsman-2023-24-annual-report
"Office of the Inspector-General of Aged Care

Annual Report 2023-24",Health and Aged Care,Office of the Inspector-General of Aged Care,https:/www.transparency.gov.au/publications/health-and-aged-care/office-of-the-inspector-general-of-aged-care/office-of-the-inspector-general-of-aged-care-annual-report-2023-24
Office of the Inspector-General of Intelligence and Security Annual Report 2023-24,Attorney-General's,Office of the Inspector-General of Intelligence and Security,https:/www.transparency.gov.au/publications/attorney-general-s/office-of-the-inspector-general-of-intelligence-and-security/office-of-the-inspector-general-of-intelligence-and-security-annual-report-2023-24
Office of the Official Secretary to the Governor-General Annual Report 2023-24,Prime Minister and Cabinet,Office of the Official Secretary to the Governor-General,https:/www.transparency.gov.au/publications/prime-minister-and-cabinet/office-of-the-official-secretary-to-the-governor-general/office-of-the-official-secretary-to-the-governor-general-annual-report-2023-24
Office of the Special Investigator Annual Report 2023-24,Attorney-General's,Office of the Special Investigator,https:/www.transparency.gov.au/publications/attorney-general-s/office-of-the-special-investigator/office-of-the-special-investigator-annual-report-2023-24
"Museum of Australian Democracy at Old Parliament House Annual Report
2023–24",Communications and the Arts,Old Parliament House,https:/www.transparency.gov.au/publications/communications-and-the-arts/old-parliament-house/museum-of-australian-democracy-at-old-parliament-house-annual-report-2023-24
Australian Organ and Tissue Donation and Transplantation Authority Annual Report 2023-24,Health,Organ and Tissue Authority (Australian Organ and Tissue Donation and Transplantation Authority),https:/www.transparency.gov.au/publications/health/organ-and-tissue-authority-australian-organ-and-tissue-donation-and-transplantation-authority/australian-organ-and-tissue-donation-and-transplantation-authority-annual-report-2023-24
Outback Stores Pty Ltd Annual Report 2023-24,Prime Minister and Cabinet,Outback Stores Pty Ltd,https:/www.transparency.gov.au/publications/prime-minister-and-cabinet/outback-stores-pty-ltd/outback-stores-pty-ltd-annual-report-2023-24
Parliamentary Budget Office Annual Report 2023-24,Parliamentary Departments (not a portfolio),Parliamentary Budget Office,https:/www.transparency.gov.au/publications/parliamentary-departments-not-a-portfolio/parliamentary-budget-office/parliamentary-budget-office-annual-report-2023-24
Parliamentary Workplace Support Service Annual Report 2023-24 ,Finance,Parliamentary Workplace Support Service,https:/www.transparency.gov.au/publications/finance/parliamentary-workplace-support-service/parliamentary-workplace-support-service-annual-report-2023-24
Annual Report 2023-24,Treasury,Productivity Commission,https:/www.transparency.gov.au/publications/treasury/productivity-commission/annual-report-2023-24
Professional Services Review Annual Report 2023–24,Health,Professional Services Review,https:/www.transparency.gov.au/publications/health/professional-services-review/professional-services-review-annual-report-2023-24
RAAF Welfare Recreational Company Annual Report 2023-24,Defence,RAAF Welfare Recreational Company,https:/www.transparency.gov.au/publications/defence/raaf-welfare-recreational-company/raaf-welfare-recreational-company-annual-report-2023-24
Regional Investment Corporation Annual Report 2023-24,Agriculture,Regional Investment Corporation,https:/www.transparency.gov.au/publications/agriculture/regional-investment-corporation/regional-investment-corporation-annual-report-2023-24
Reserve Bank of Australia Annual Report 2023-24,Treasury,Reserve Bank of Australia,https:/www.transparency.gov.au/publications/treasury/reserve-bank-of-australia/reserve-bank-of-australia-annual-report-2023-24
Royal Australian Air Force Veterans' Residences Trust Fund Annual Report 2023-24,Defence,Royal Australian Air Force Veterans' Residences Trust Fund,https:/www.transparency.gov.au/publications/defence/royal-australian-air-force-veterans-residences-trust-fund/royal-australian-air-force-veterans-residences-trust-fund-annual-report-2023-24
Royal Australian Air Force Welfare Fund Annual Report 1 July 2023 to 30 June 2024,Defence,Royal Australian Air Force Welfare Trust Fund,https:/www.transparency.gov.au/publications/defence/royal-australian-air-force-welfare-trust-fund/royal-australian-air-force-welfare-fund-annual-report-1-july-2023-to-30-june-2024
Annual Report Royal Australian Mint 2023 -2024,Treasury,Royal Australian Mint,https:/www.transparency.gov.au/publications/treasury/royal-australian-mint/annual-report-royal-australian-mint-2023-2024
Royal Australian Navy Relief Trust Fund Annual Report 2023-24,Defence,Royal Australian Navy Relief Trust Fund,https:/www.transparency.gov.au/publications/defence/royal-australian-navy-relief-trust-fund/royal-australian-navy-relief-trust-fund-annual-report-2023-24
AgriFutures Australia Annual Report 2023-2024,Agriculture,Rural Industries Research and Development Corporation,https:/www.transparency.gov.au/publications/agriculture/rural-industries-research-and-development-corporation/agrifutures-australia-annual-report-2023-2024
Safe Work Australia Annual Report 2023-24,Attorney-General's,Safe Work Australia,https:/www.transparency.gov.au/publications/attorney-general-s/safe-work-australia/safe-work-australia-annual-report-2023-24
Screen Australia Annual Report 2023-2024,Communications and the Arts,Screen Australia,https:/www.transparency.gov.au/publications/communications-and-the-arts/screen-australia/screen-australia-annual-report-2023-2024
"Seafarers Safety, Rehabilitation and Compensation Authority Annual Report 2023-24",Attorney-General's,"Seafarers Safety, Rehabilitation and Compensation Authority (Seacare Authority)",https:/www.transparency.gov.au/publications/attorney-general-s/seafarers-safety-rehabilitation-and-compensation-authority-seacare-authority/seafarers-safety-rehabilitation-and-compensation-authority-annual-report-2023-24
Services Australia Annual Report 2023-24,Services Australia,Services Australia,https:/www.transparency.gov.au/publications/services-australia/services-australia/services-australia-annual-report-2023-24
Snowy Hydro Limited Annual Report 2023-24,"Climate Change, Energy, the Environment and Water",Snowy Hydro Limited,https:/www.transparency.gov.au/publications/climate-change-energy-the-environment-and-water/snowy-hydro-limited/snowy-hydro-limited-annual-report-2023-24
Special Broadcasting Service Corporation Annual Report 2023-24,Communications and the Arts,Special Broadcasting Service Corporation,https:/www.transparency.gov.au/publications/communications-and-the-arts/special-broadcasting-service-corporation/special-broadcasting-service-corporation-annual-report-2023-24
Sport Integrity Australia Annual Report 2023-24,Health,Sport Integrity Australia,https:/www.transparency.gov.au/publications/health/sport-integrity-australia/sport-integrity-australia-annual-report-2023-24
Sydney Harbour Federation Trust Annual Report 2023-24,"Agriculture, Water and the Environment",Sydney Harbour Federation Trust,https:/www.transparency.gov.au/publications/agriculture-water-and-the-environment/sydney-harbour-federation-trust/sydney-harbour-federation-trust-annual-report-2023-24
Tertiary Education Quality and Standards Agency Annual Report 2023–24,Education,Tertiary Education Quality and Standards Agency,https:/www.transparency.gov.au/publications/education/tertiary-education-quality-and-standards-agency/tertiary-education-quality-and-standards-agency-annual-report-2023-24
Annual Report 2023-2024,Prime Minister and Cabinet,Tiwi Land Council,https:/www.transparency.gov.au/publications/prime-minister-and-cabinet/tiwi-land-council/annual-report-2023-2024
Torres Strait Regional Authority Annual Report 2023-24,Prime Minister and Cabinet,Torres Strait Regional Authority,https:/www.transparency.gov.au/publications/prime-minister-and-cabinet/torres-strait-regional-authority/torres-strait-regional-authority-annual-report-2023-24
Tourism Australia Annual Report 2023-24,Foreign Affairs and Trade,Tourism Australia,https:/www.transparency.gov.au/publications/foreign-affairs-and-trade/tourism-australia/tourism-australia-annual-report-2023-24
WSA Co Limited Annual Report 2023–24,"Infrastructure, Transport, Cities and Regional Development",WSA Co Ltd,https:/www.transparency.gov.au/publications/infrastructure-transport-cities-and-regional-development/wsa-co-ltd/wsa-co-limited-annual-report-2023-24
Wine Australia Annual Report 2023-24,Agriculture,Wine Australia,https:/www.transparency.gov.au/publications/agriculture/wine-australia/wine-australia-annual-report-2023-24
Workplace Gender Equality Agency Annual Report 2023-24,Prime Minister and Cabinet,Workplace Gender Equality Agency,https:/www.transparency.gov.au/publications/prime-minister-and-cabinet/workplace-gender-equality-agency/workplace-gender-equality-agency-annual-report-2023-24
